<?xml version="1.0" encoding="utf-8"?>
<xs:schema xmlns:xs="http://www.w3.org/2001/XMLSchema" xmlns="http://namm.org/b2b/2015/schemas" targetNamespace="http://namm.org/b2b/2015/schemas" elementFormDefault="qualified">
  <xs:element name="NAMM_POStatus">
    <xs:complexType>
      <xs:sequence>
        <xs:element name="Id">
	<xs:simpleType>
		<xs:restriction base="xs:string">
		<xs:maxLength value="50"/>
		</xs:restriction>
	</xs:simpleType>
	</xs:element>
        <xs:element name="POStatusRequestId">
	<xs:simpleType>
		<xs:restriction base="xs:string">
		<xs:maxLength value="50"/>
		</xs:restriction>
	</xs:simpleType>
	</xs:element>
        <xs:element name="Timestamp" type="xs:dateTime" />
        <xs:element name="BuyerOrderId">
	<xs:simpleType>
		<xs:restriction base="xs:string">
		<xs:maxLength value="25"/>
		</xs:restriction>
	</xs:simpleType>
	</xs:element>
        <xs:element name="DateOrdered" type="xs:date" />
        <xs:element name="BuyerName" type="xs:string"/>
        <xs:element name="Supplier">
								<xs:complexType>
									<xs:sequence>
										<xs:element name="PartyId">
											<xs:simpleType>
												<xs:restriction base="xs:string">
													<xs:maxLength value="50"/>
												</xs:restriction>
											</xs:simpleType>
										</xs:element>
										<xs:element name="Name" minOccurs="0">
											<xs:simpleType>
												<xs:restriction base="xs:string">
													<xs:maxLength value="35"/>
												</xs:restriction>
											</xs:simpleType>
										</xs:element>
										<xs:element name="Address" minOccurs="0">
											<xs:complexType>
												<xs:sequence>
													<xs:element name="Attn" minOccurs="0">
														<xs:simpleType>
															<xs:restriction base="xs:string">
																<xs:maxLength value="35"/>
															</xs:restriction>
														</xs:simpleType>
													</xs:element>
													<xs:element name="Address1" minOccurs="0">
														<xs:simpleType>
															<xs:restriction base="xs:string">
																<xs:maxLength value="35"/>
															</xs:restriction>
														</xs:simpleType>
													</xs:element>
													<xs:element name="Address2" minOccurs="0">
														<xs:simpleType>
															<xs:restriction base="xs:string">
																<xs:maxLength value="35"/>
															</xs:restriction>
														</xs:simpleType>
													</xs:element>
													<xs:element name="Address3" minOccurs="0">
														<xs:simpleType>
															<xs:restriction base="xs:string">
																<xs:maxLength value="35"/>
															</xs:restriction>
														</xs:simpleType>
													</xs:element>
													<xs:element name="City" minOccurs="0">
														<xs:simpleType>
															<xs:restriction base="xs:string">
																<xs:maxLength value="30"/>
															</xs:restriction>
														</xs:simpleType>
													</xs:element>
													<xs:element name="State" minOccurs="0">
														<xs:simpleType>
															<xs:restriction base="xs:string">
																<xs:maxLength value="2"/>
															</xs:restriction>
														</xs:simpleType>
													</xs:element>
													<xs:element name="PostalCode" minOccurs="0">
														<xs:simpleType>
															<xs:restriction base="xs:string">
																<xs:maxLength value="9"/>
															</xs:restriction>
														</xs:simpleType>
													</xs:element>
													<xs:element name="Country" minOccurs="0">
														<xs:simpleType>
															<xs:restriction base="xs:string">
																<xs:maxLength value="50"/>
															</xs:restriction>
														</xs:simpleType>
													</xs:element>
													<xs:element name="CountryCode" minOccurs="0">
														<xs:simpleType>
															<xs:restriction base="xs:string">
																<xs:maxLength value="2"/>
															</xs:restriction>
														</xs:simpleType>
													</xs:element>
												</xs:sequence>
											</xs:complexType>
										</xs:element>
									</xs:sequence>
								</xs:complexType>
							</xs:element>
    
		<xs:element name="SoldTo">
								<xs:complexType>
									<xs:sequence>
										<xs:element name="PartyId">
											<xs:simpleType>
												<xs:restriction base="xs:string">
													<xs:maxLength value="50"/>
												</xs:restriction>
											</xs:simpleType>
										</xs:element>
										<xs:element name="Name" minOccurs="0">
											<xs:simpleType>
												<xs:restriction base="xs:string">
													<xs:maxLength value="35"/>
												</xs:restriction>
											</xs:simpleType>
										</xs:element>
										<xs:element name="Address" minOccurs="0">
											<xs:complexType>
												<xs:sequence>
													<xs:element name="Attn" minOccurs="0">
														<xs:simpleType>
															<xs:restriction base="xs:string">
																<xs:maxLength value="35"/>
															</xs:restriction>
														</xs:simpleType>
													</xs:element>
													<xs:element name="Address1" minOccurs="0">
														<xs:simpleType>
															<xs:restriction base="xs:string">
																<xs:maxLength value="35"/>
															</xs:restriction>
														</xs:simpleType>
													</xs:element>
													<xs:element name="Address2" minOccurs="0">
														<xs:simpleType>
															<xs:restriction base="xs:string">
																<xs:maxLength value="35"/>
															</xs:restriction>
														</xs:simpleType>
													</xs:element>
													<xs:element name="Address3" minOccurs="0">
														<xs:simpleType>
															<xs:restriction base="xs:string">
																<xs:maxLength value="35"/>
															</xs:restriction>
														</xs:simpleType>
													</xs:element>
													<xs:element name="City" minOccurs="0">
														<xs:simpleType>
															<xs:restriction base="xs:string">
																<xs:maxLength value="30"/>
															</xs:restriction>
														</xs:simpleType>
													</xs:element>
													<xs:element name="State" minOccurs="0">
														<xs:simpleType>
															<xs:restriction base="xs:string">
																<xs:maxLength value="2"/>
															</xs:restriction>
														</xs:simpleType>
													</xs:element>
													<xs:element name="PostalCode" minOccurs="0">
														<xs:simpleType>
															<xs:restriction base="xs:string">
																<xs:maxLength value="9"/>
															</xs:restriction>
														</xs:simpleType>
													</xs:element>
													<xs:element name="Country" minOccurs="0">
														<xs:simpleType>
															<xs:restriction base="xs:string">
																<xs:maxLength value="50"/>
															</xs:restriction>
														</xs:simpleType>
													</xs:element>
													<xs:element name="CountryCode" minOccurs="0">
														<xs:simpleType>
															<xs:restriction base="xs:string">
																<xs:maxLength value="2"/>
															</xs:restriction>
														</xs:simpleType>
													</xs:element>
												</xs:sequence>
											</xs:complexType>
										</xs:element>
									</xs:sequence>
								</xs:complexType>
							</xs:element>

        <xs:element name="StatusCode" type="xs:string"/>
        <xs:element name="PaymentTerms">
          <xs:complexType>
            <xs:sequence>
              <xs:element name="StatusCode" type="xs:string" />
              <xs:element name="StatusMessage" type="xs:string" />
              <xs:element name="TermsCode">
                <xs:simpleType>
                  <xs:restriction base="xs:string">
                    <xs:maxLength value="15"/>
                  </xs:restriction>
                </xs:simpleType>
              </xs:element>
            </xs:sequence>
          </xs:complexType>
        </xs:element>
        <xs:element name="ShipmentTerms">
          <xs:complexType>
            <xs:sequence>
              <xs:element name="StatusCode" type="xs:string" minOccurs="0"/>
            </xs:sequence>
          </xs:complexType>
        </xs:element>
        <xs:element name="ShipTo">
								<xs:complexType>
									<xs:sequence>
										<xs:element name="PartyId">
											<xs:simpleType>
												<xs:restriction base="xs:string">
													<xs:maxLength value="50"/>
												</xs:restriction>
											</xs:simpleType>
										</xs:element>
										<xs:element name="Name" minOccurs="0">
											<xs:simpleType>
												<xs:restriction base="xs:string">
													<xs:maxLength value="35"/>
												</xs:restriction>
											</xs:simpleType>
										</xs:element>
										<xs:element name="Address" minOccurs="0">
											<xs:complexType>
												<xs:sequence>
													<xs:element name="Attn" minOccurs="0">
														<xs:simpleType>
															<xs:restriction base="xs:string">
																<xs:maxLength value="35"/>
															</xs:restriction>
														</xs:simpleType>
													</xs:element>
													<xs:element name="Address1" minOccurs="0">
														<xs:simpleType>
															<xs:restriction base="xs:string">
																<xs:maxLength value="35"/>
															</xs:restriction>
														</xs:simpleType>
													</xs:element>
													<xs:element name="Address2" minOccurs="0">
														<xs:simpleType>
															<xs:restriction base="xs:string">
																<xs:maxLength value="35"/>
															</xs:restriction>
														</xs:simpleType>
													</xs:element>
													<xs:element name="Address3" minOccurs="0">
														<xs:simpleType>
															<xs:restriction base="xs:string">
																<xs:maxLength value="35"/>
															</xs:restriction>
														</xs:simpleType>
													</xs:element>
													<xs:element name="City" minOccurs="0">
														<xs:simpleType>
															<xs:restriction base="xs:string">
																<xs:maxLength value="30"/>
															</xs:restriction>
														</xs:simpleType>
													</xs:element>
													<xs:element name="State" minOccurs="0">
														<xs:simpleType>
															<xs:restriction base="xs:string">
																<xs:maxLength value="2"/>
															</xs:restriction>
														</xs:simpleType>
													</xs:element>
													<xs:element name="PostalCode" minOccurs="0">
														<xs:simpleType>
															<xs:restriction base="xs:string">
																<xs:maxLength value="9"/>
															</xs:restriction>
														</xs:simpleType>
													</xs:element>
													<xs:element name="Country" minOccurs="0">
														<xs:simpleType>
															<xs:restriction base="xs:string">
																<xs:maxLength value="50"/>
															</xs:restriction>
														</xs:simpleType>
													</xs:element>
													<xs:element name="CountryCode" minOccurs="0">
														<xs:simpleType>
															<xs:restriction base="xs:string">
																<xs:maxLength value="2"/>
															</xs:restriction>
														</xs:simpleType>
													</xs:element>
												</xs:sequence>
											</xs:complexType>
										</xs:element>
									</xs:sequence>
								</xs:complexType>
							</xs:element>
        <xs:element name="Items">
          <xs:complexType>
            <xs:sequence>
              <xs:element maxOccurs="unbounded" name="Item">
                <xs:complexType>
                  <xs:sequence>
                    <xs:element name="POLineNbr" type="xs:integer" />
                    <xs:element name="SequenceNbr" type="xs:integer" />
                    <xs:element name="StatusCode" type="xs:string" />
                    <xs:element name="StatusMessage" type="xs:string" />
                    <xs:element name="Qty" type="xs:decimal" />
                    <xs:element name="OriginalOrderQty" type="xs:decimal" />
                    <xs:element name="QtyUOM" type="xs:string" />
                    <xs:element name="UCValue" type="xs:decimal" />
                    <xs:element name="OriginalOrderUCValue" type="xs:decimal" />
                    <xs:element name="UCCurrencyCode" type="xs:string" />
                    <xs:element name="EstimatedShipDate" type="xs:date" minOccurs="0"/>
                    <xs:element name="SupplierOrderId" type="xs:string" />
                    <xs:element name="BuyerItemId" type="xs:string" />
                    <xs:element name="SupplierItemId" type="xs:string" />
                    <xs:element name="BarCodeId" type="xs:string" />
                    <xs:element name="BarCodeType" type="xs:string" />

                  <xs:element name="ShipTo" minOccurs="0">
								<xs:complexType>
									<xs:sequence>
										<xs:element name="PartyId">
											<xs:simpleType>
												<xs:restriction base="xs:string">
													<xs:maxLength value="50"/>
												</xs:restriction>
											</xs:simpleType>
										</xs:element>
										<xs:element name="Name" minOccurs="0">
											<xs:simpleType>
												<xs:restriction base="xs:string">
													<xs:maxLength value="35"/>
												</xs:restriction>
											</xs:simpleType>
										</xs:element>
										<xs:element name="Address" minOccurs="0">
											<xs:complexType>
												<xs:sequence>
													<xs:element name="Attn" minOccurs="0">
														<xs:simpleType>
															<xs:restriction base="xs:string">
																<xs:maxLength value="35"/>
															</xs:restriction>
														</xs:simpleType>
													</xs:element>
													<xs:element name="Address1" minOccurs="0">
														<xs:simpleType>
															<xs:restriction base="xs:string">
																<xs:maxLength value="35"/>
															</xs:restriction>
														</xs:simpleType>
													</xs:element>
													<xs:element name="Address2" minOccurs="0">
														<xs:simpleType>
															<xs:restriction base="xs:string">
																<xs:maxLength value="35"/>
															</xs:restriction>
														</xs:simpleType>
													</xs:element>
													<xs:element name="Address3" minOccurs="0">
														<xs:simpleType>
															<xs:restriction base="xs:string">
																<xs:maxLength value="35"/>
															</xs:restriction>
														</xs:simpleType>
													</xs:element>
													<xs:element name="City" minOccurs="0">
														<xs:simpleType>
															<xs:restriction base="xs:string">
																<xs:maxLength value="30"/>
															</xs:restriction>
														</xs:simpleType>
													</xs:element>
													<xs:element name="State" minOccurs="0">
														<xs:simpleType>
															<xs:restriction base="xs:string">
																<xs:maxLength value="2"/>
															</xs:restriction>
														</xs:simpleType>
													</xs:element>
													<xs:element name="PostalCode" minOccurs="0">
														<xs:simpleType>
															<xs:restriction base="xs:string">
																<xs:maxLength value="9"/>
															</xs:restriction>
														</xs:simpleType>
													</xs:element>
													<xs:element name="Country" minOccurs="0">
														<xs:simpleType>
															<xs:restriction base="xs:string">
																<xs:maxLength value="50"/>
															</xs:restriction>
														</xs:simpleType>
													</xs:element>
													<xs:element name="CountryCode" minOccurs="0">
														<xs:simpleType>
															<xs:restriction base="xs:string">
																<xs:maxLength value="2"/>
															</xs:restriction>
														</xs:simpleType>
													</xs:element>
												</xs:sequence>
											</xs:complexType>
										</xs:element>
									</xs:sequence>
								</xs:complexType>
							</xs:element>


                  </xs:sequence>
                </xs:complexType>
              </xs:element>
            </xs:sequence>
          </xs:complexType>
        </xs:element>
      </xs:sequence>
      <xs:attribute name="version" type="xs:decimal" use="required" fixed="2015.1"/>
    </xs:complexType>
  </xs:element>
</xs:schema>